{
  "$schema": "../schemas/quest.schema.json",
  "id": "ottawa-parliament-hill",
  "levelId": "ottawa",
  "giver": "officer",
  "title": {
    "en": "Skate to Parliament Hill",
    "fr": "Patinez jusqu'à la Colline du Parlement"
  },
  "summary": {
    "en": "Skate up the canal with the officer. You stop at the Library, at the Peace Tower and at the warming hut, and at each one the officer explains a piece of how Canada is governed and then asks you about it.",
    "fr": "Patinez sur le canal avec l'agent. Vous vous arrêtez à la Bibliothèque, à la tour de la Paix et à la cabane chauffée; à chaque halte, l'agent vous explique un aspect de la façon dont le Canada est gouverné, puis vous pose des questions dessus."
  },
  "declinedLine": {
    "speaker": "officer",
    "expression": "neutral",
    "text": {
      "en": "No trouble. I will be here on the canal when you want to go.",
      "fr": "Pas de souci. Je serai ici, sur le canal, quand vous voudrez partir."
    },
    "fact": {
      "factual": false,
      "source": null,
      "verification": null
    }
  },
  "reminderLine": {
    "speaker": "officer",
    "expression": "neutral",
    "text": {
      "en": "Keep going up the canal. The Library comes first, then the Peace Tower, then the warming hut.",
      "fr": "Continuez sur le canal. La Bibliothèque vient en premier, puis la tour de la Paix, puis la cabane chauffée."
    },
    "fact": {
      "factual": false,
      "source": null,
      "verification": null
    }
  },
  "afterLine": {
    "speaker": "officer",
    "expression": "happy",
    "text": {
      "en": "The federal government takes care of things like defence, money and citizenship. The provinces take care of schools, health and highways.",
      "fr": "Le gouvernement fédéral s'occupe de choses comme la défense, la monnaie et la citoyenneté. Les provinces s'occupent des écoles, de la santé et des routes."
    },
    "fact": {
      "factual": true,
      "source": {
        "sourceId": "discover-canada",
        "chapter": "How Canadians Govern Themselves",
        "page": 54,
        "url": "https://www.canada.ca/en/immigration-refugees-citizenship/corporate/publications-manuals/discover-canada.html",
        "sourceHash": "fd51046981916115cc39b989e9eedd3ab2c5943aeb7e0fe4e237e13a0da7c836",
        "asOf": "2026-09-09T00:00:00Z",
        "volatile": false,
        "quote": "These include defence, foreign policy, interprovincial trade and communications, currency, navigation, criminal law and citizenship. The provinces are responsible for municipal government, education, health, natural resources, property and civil rights, and highways."
      },
      "verification": {
        "status": "verified",
        "model": "claude-opus-5[1m]",
        "checkedAt": "2026-09-13T16:13:25Z",
        "sourceHash": "fd51046981916115cc39b989e9eedd3ab2c5943aeb7e0fe4e237e13a0da7c836",
        "evidence": "In our federal state, the federal government takes responsibility for matters of national and international concern. These include defence, foreign policy, interprovincial trade and communications, currency, navigation, criminal law and citizenship. The provinces are responsible for municipal government, education, health, natural resources, property and civil rights, and highways."
      }
    }
  },
  "doneLine": {
    "speaker": "officer",
    "expression": "happy",
    "text": {
      "en": "You skated the canal from the Library to the warming hut, stopping three times, and answered everything I asked about how Canada is governed.",
      "fr": "Vous avez patiné sur le canal, de la Bibliothèque jusqu'à la cabane chauffée, avec trois haltes, et répondu à tout ce que je vous ai demandé sur la gouvernance du Canada."
    },
    "fact": {
      "factual": false,
      "source": null,
      "verification": null
    }
  },
  "steps": [
    {
      "id": "talk-to-the-officer",
      "kind": "talk",
      "targetId": "officer",
      "prompt": {
        "en": "Meet the officer on the canal",
        "fr": "Retrouvez l'agent sur le canal"
      },
      "dialogue": [
        {
          "speaker": "officer",
          "expression": "happy",
          "text": {
            "en": "Hello! Welcome to Ottawa. Ottawa is Canada's capital city.",
            "fr": "Bonjour! Bienvenue à Ottawa. Ottawa est la capitale du Canada."
          },
          "fact": {
            "factual": true,
            "source": {
              "sourceId": "discover-canada",
              "chapter": "Canada's Regions",
              "page": 94,
              "url": "https://www.canada.ca/en/immigration-refugees-citizenship/corporate/publications-manuals/discover-canada.html",
              "sourceHash": "fd51046981916115cc39b989e9eedd3ab2c5943aeb7e0fe4e237e13a0da7c836",
              "asOf": "2026-09-08T00:00:00Z",
              "volatile": false,
              "quote": "Ottawa, located on the Ottawa River, was chosen as the capital in 1857 by Queen Victoria"
            },
            "verification": {
              "status": "verified",
              "model": "claude-opus-5[1m]",
              "checkedAt": "2026-09-13T16:13:25Z",
              "sourceHash": "fd51046981916115cc39b989e9eedd3ab2c5943aeb7e0fe4e237e13a0da7c836",
              "evidence": "The National Capital Ottawa, located on the Ottawa River, was chosen as the capital in 1857 … The National Capital Region, 4,700 square kilometres surrounding Ottawa, preserves and enhances the area’s built heritage and natural environment."
            }
          }
        },
        {
          "speaker": "officer",
          "expression": "neutral",
          "text": {
            "en": "Skate up the canal with me. We stop three times, and each stop is a piece of how this country is run.",
            "fr": "Patinez sur le canal avec moi. On fait trois haltes, et chacune porte sur un aspect de la gouvernance du pays."
          },
          "fact": {
            "factual": false,
            "source": null,
            "verification": null
          }
        }
      ]
    },
    {
      "id": "skate-to-the-library",
      "kind": "visit",
      "targetId": "library-of-parliament",
      "prompt": {
        "en": "Skate up to the Library of Parliament",
        "fr": "Patinez jusqu'à la Bibliothèque du Parlement"
      },
      "dialogue": [
        {
          "speaker": "officer",
          "expression": "neutral",
          "text": {
            "en": "Stop here a moment. This is the working end of Parliament, and the work is slower than people think.",
            "fr": "Arrêtez-vous un instant. C'est ici que le Parlement travaille, et le travail est plus lent qu'on ne le croit."
          },
          "fact": {
            "factual": false,
            "source": null,
            "verification": null
          }
        },
        {
          "speaker": "officer",
          "expression": "thinking",
          "text": {
            "en": "A bill is a proposal for a new law. Nothing becomes law until both chambers have passed it and it has been given royal assent.",
            "fr": "Un projet de loi est une proposition de nouvelle loi. Rien ne devient loi tant que les deux chambres ne l'ont pas adopté et qu'il n'a pas reçu la sanction royale."
          },
          "fact": {
            "factual": true,
            "source": {
              "sourceId": "discover-canada",
              "chapter": "How Canadians Govern Themselves",
              "page": 55,
              "url": "https://www.canada.ca/en/immigration-refugees-citizenship/corporate/publications-manuals/discover-canada.html",
              "sourceHash": "fd51046981916115cc39b989e9eedd3ab2c5943aeb7e0fe4e237e13a0da7c836",
              "asOf": "2026-09-08T00:00:00Z",
              "volatile": false,
              "quote": "Both the House of Commons and the Senate consider and review bills (proposals for new laws). No bill can become law in Canada until it has been passed by both chambers and has received royal assent, granted by the Governor General on behalf of the Sovereign."
            },
            "verification": {
              "status": "unverified",
              "model": "",
              "checkedAt": null,
              "sourceHash": "",
              "evidence": ""
            }
          }
        }
      ]
    },
    {
      "id": "answer-at-the-library",
      "kind": "answer",
      "targetId": "government",
      "subject": "government",
      "count": 2,
      "prompt": {
        "en": "Answer 2 questions about how a bill becomes law",
        "fr": "Répondez à 2 questions sur la façon dont un projet de loi devient une loi"
      }
    },
    {
      "id": "find-the-peace-tower",
      "kind": "visit",
      "targetId": "parliament-hill",
      "prompt": {
        "en": "Find the Peace Tower",
        "fr": "Trouvez la tour de la Paix"
      },
      "dialogue": [
        {
          "speaker": "officer",
          "expression": "happy",
          "text": {
            "en": "Stand still and look up. What you are looking at is not one thing. It is three.",
            "fr": "Arrêtez-vous et levez les yeux. Ce que vous regardez n'est pas une seule chose. C'en est trois."
          },
          "fact": {
            "factual": false,
            "source": null,
            "verification": null
          }
        },
        {
          "speaker": "officer",
          "expression": "neutral",
          "text": {
            "en": "Parliament has three parts: the Sovereign, the Senate and the House of Commons. In a province it is the Lieutenant Governor and the elected Assembly.",
            "fr": "Le Parlement compte trois parties : le souverain, le Sénat et la Chambre des communes. Dans une province, ce sont le lieutenant-gouverneur et l'Assemblée élue."
          },
          "fact": {
            "factual": true,
            "source": {
              "sourceId": "discover-canada",
              "chapter": "How Canadians Govern Themselves",